<?xml version="1.0" encoding="UTF-8"?>
<xs:schema xmlns:xs="http://www.w3.org/2001/XMLSchema">
<xs:import namespace="http://www.w3.org/XML/1998/namespace"/>
<xs:include schemaLocation="langtag.xsd"/>
    <xs:element name="iri" type="xs:string"/>
    <xs:element name="playerName" type="LangTag"/>
    <xs:element name="nickname" type="LangTag"/>
    <xs:element name="Player">
        <xs:complexType>
            <xs:sequence>
                <xs:element ref="iri"/>
                <xs:element ref="playerName" minOccurs="0"/>
                <xs:element ref="nickname" minOccurs="0"/>
            </xs:sequence>
        </xs:complexType>
    </xs:element>
    <xs:element name="Players">
    <xs:complexType>
      <xs:sequence>
        <xs:element ref="Player" minOccurs="0" maxOccurs="unbounded"/>
      </xs:sequence>
    </xs:complexType>
  </xs:element>
</xs:schema>